{
  "family": "login",
  "fields": [
    {
      "expected_modifiers": [],
      "label": "email",
      "provenance": {
        "control": "input",
        "declared_autocomplete": "email",
        "delivery": "static",
        "element_id": "account-email",
        "identifier_style": "semantic",
        "injection_slot": null,
        "input_type": "email",
        "label_text": "Email address",
        "name": "account_email",
        "placeholder": "you@example.com",
        "role": "email_address",
        "section": "account",
        "selector_strategy": "id",
        "shadow_host": null,
        "slot_key": "account.email_address.1",
        "tier": "partial",
        "transforms": []
      },
      "selector": "#account-email"
    },
    {
      "expected_modifiers": [],
      "label": "current-password",
      "provenance": {
        "control": "input",
        "declared_autocomplete": "fname",
        "delivery": "static",
        "element_id": "account-password",
        "identifier_style": "semantic",
        "injection_slot": null,
        "input_type": "password",
        "label_text": "Password",
        "name": "account_password",
        "placeholder": null,
        "role": "current_password",
        "section": "account",
        "selector_strategy": "id",
        "shadow_host": null,
        "slot_key": "account.current_password.2",
        "tier": "partial",
        "transforms": [
          "wrong_declaration"
        ]
      },
      "selector": "#account-password"
    },
    {
      "expected_modifiers": [],
      "label": "NOT_AUTOFILLABLE",
      "provenance": {
        "control": "input",
        "declared_autocomplete": null,
        "delivery": "static",
        "element_id": "extras-termsaccepted",
        "identifier_style": "semantic",
        "injection_slot": null,
        "input_type": "checkbox",
        "label_text": "I accept the terms of sale",
        "name": "extras_termsaccepted",
        "placeholder": null,
        "role": "consent",
        "section": "extras",
        "selector_strategy": "id",
        "shadow_host": null,
        "slot_key": "extras.consent.3",
        "tier": "partial",
        "transforms": []
      },
      "selector": "#extras-termsaccepted"
    }
  ],
  "form_id": "login-02-en-US-partial-v0",
  "generator_version": "1.0.0",
  "locale": "en-US",
  "page_notes": {
    "canvas_pseudo_fields": [],
    "injected_selectors": [],
    "shadow_hosts": []
  },
  "schema_version": 1,
  "template_id": "login-02",
  "tier": "partial",
  "variant": 0
}
