{
  "family": "signup",
  "fields": [
    {
      "expected_modifiers": [],
      "label": "given-name",
      "provenance": {
        "control": "input",
        "declared_autocomplete": "given-name",
        "delivery": "static",
        "element_id": "identity-firstname",
        "identifier_style": "semantic",
        "injection_slot": null,
        "input_type": "text",
        "label_text": "First name",
        "name": "identity_firstname",
        "placeholder": null,
        "role": "given_name",
        "section": "identity",
        "selector_strategy": "id",
        "shadow_host": null,
        "slot_key": "identity.given_name.1",
        "tier": "clean",
        "transforms": []
      },
      "selector": "#identity-firstname"
    },
    {
      "expected_modifiers": [],
      "label": "family-name",
      "provenance": {
        "control": "input",
        "declared_autocomplete": "family-name",
        "delivery": "static",
        "element_id": "identity-lastname",
        "identifier_style": "semantic",
        "injection_slot": null,
        "input_type": "text",
        "label_text": "Last name",
        "name": "identity_lastname",
        "placeholder": null,
        "role": "family_name",
        "section": "identity",
        "selector_strategy": "id",
        "shadow_host": null,
        "slot_key": "identity.family_name.2",
        "tier": "clean",
        "transforms": []
      },
      "selector": "#identity-lastname"
    },
    {
      "expected_modifiers": [],
      "label": "email",
      "provenance": {
        "control": "input",
        "declared_autocomplete": "email",
        "delivery": "static",
        "element_id": "identity-email",
        "identifier_style": "semantic",
        "injection_slot": null,
        "input_type": "email",
        "label_text": "Email address",
        "name": "identity_email",
        "placeholder": "you@example.com",
        "role": "email_address",
        "section": "identity",
        "selector_strategy": "id",
        "shadow_host": null,
        "slot_key": "identity.email_address.3",
        "tier": "clean",
        "transforms": []
      },
      "selector": "#identity-email"
    },
    {
      "expected_modifiers": [],
      "label": "username",
      "provenance": {
        "control": "input",
        "declared_autocomplete": "username",
        "delivery": "static",
        "element_id": "account-username",
        "identifier_style": "semantic",
        "injection_slot": null,
        "input_type": "text",
        "label_text": "Username",
        "name": "account_username",
        "placeholder": null,
        "role": "username",
        "section": "account",
        "selector_strategy": "id",
        "shadow_host": null,
        "slot_key": "account.username.4",
        "tier": "clean",
        "transforms": []
      },
      "selector": "#account-username"
    },
    {
      "expected_modifiers": [],
      "label": "new-password",
      "provenance": {
        "control": "input",
        "declared_autocomplete": "new-password",
        "delivery": "static",
        "element_id": "account-newpassword",
        "identifier_style": "semantic",
        "injection_slot": null,
        "input_type": "password",
        "label_text": "Password",
        "name": "account_newpassword",
        "placeholder": null,
        "role": "new_password",
        "section": "account",
        "selector_strategy": "id",
        "shadow_host": null,
        "slot_key": "account.new_password.5",
        "tier": "clean",
        "transforms": []
      },
      "selector": "#account-newpassword"
    },
    {
      "expected_modifiers": [],
      "label": "new-password",
      "provenance": {
        "control": "input",
        "declared_autocomplete": "new-password",
        "delivery": "static",
        "element_id": "account-confirmpassword",
        "identifier_style": "semantic",
        "injection_slot": null,
        "input_type": "password",
        "label_text": "Confirm password",
        "name": "account_confirmpassword",
        "placeholder": null,
        "role": "new_password_confirm",
        "section": "account",
        "selector_strategy": "id",
        "shadow_host": null,
        "slot_key": "account.new_password_confirm.6",
        "tier": "clean",
        "transforms": []
      },
      "selector": "#account-confirmpassword"
    },
    {
      "expected_modifiers": [],
      "label": "NOT_AUTOFILLABLE",
      "provenance": {
        "control": "input",
        "declared_autocomplete": null,
        "delivery": "static",
        "element_id": "extras-termsaccepted",
        "identifier_style": "semantic",
        "injection_slot": null,
        "input_type": "checkbox",
        "label_text": "I accept the terms of sale",
        "name": "extras_termsaccepted",
        "placeholder": null,
        "role": "consent",
        "section": "extras",
        "selector_strategy": "id",
        "shadow_host": null,
        "slot_key": "extras.consent.7",
        "tier": "clean",
        "transforms": []
      },
      "selector": "#extras-termsaccepted"
    }
  ],
  "form_id": "signup-01-en-US-clean-v0",
  "generator_version": "1.1.0",
  "locale": "en-US",
  "page_notes": {
    "canvas_pseudo_fields": [],
    "injected_selectors": [],
    "shadow_hosts": []
  },
  "schema_version": 1,
  "template_id": "signup-01",
  "tier": "clean",
  "variant": 0
}
