{
  "family": "address",
  "fields": [
    {
      "expected_modifiers": [],
      "label": "name",
      "provenance": {
        "control": "input",
        "declared_autocomplete": null,
        "delivery": "static",
        "element_id": null,
        "identifier_style": "bare",
        "injection_slot": null,
        "input_type": "text",
        "label_text": null,
        "name": null,
        "placeholder": "Full name",
        "role": "full_name",
        "section": "identity",
        "selector_strategy": "nth_of_type",
        "shadow_host": null,
        "slot_key": "identity.full_name.1",
        "tier": "hostile",
        "transforms": [
          "label_removed",
          "generic_identifier",
          "placeholder_as_label",
          "input_type_degraded"
        ]
      },
      "selector": "form[name=\"f1\"] > div:nth-of-type(1) > div:nth-of-type(1) > div:nth-of-type(1) > input:nth-of-type(1)"
    },
    {
      "expected_modifiers": [],
      "label": "street-address",
      "provenance": {
        "control": "input",
        "declared_autocomplete": null,
        "delivery": "static",
        "element_id": null,
        "identifier_style": "legacy_name",
        "injection_slot": null,
        "input_type": "text",
        "label_text": null,
        "name": "ctl00$txt2",
        "placeholder": null,
        "role": "street_address",
        "section": "address",
        "selector_strategy": "form_name",
        "shadow_host": null,
        "slot_key": "address.street_address.2",
        "tier": "hostile",
        "transforms": [
          "label_removed",
          "generic_identifier",
          "no_text_signal",
          "input_type_degraded"
        ]
      },
      "selector": "form[name=\"f1\"] [name=\"ctl00$txt2\"]"
    },
    {
      "expected_modifiers": [],
      "label": "address-level2",
      "provenance": {
        "control": "input",
        "declared_autocomplete": null,
        "delivery": "static",
        "element_id": "ctl00_txt3_d7df562b",
        "identifier_style": "hex_id",
        "injection_slot": null,
        "input_type": "text",
        "label_text": null,
        "name": "ctl00$txt3",
        "placeholder": "Springfield",
        "role": "city",
        "section": "address",
        "selector_strategy": "form_name",
        "shadow_host": null,
        "slot_key": "address.city.3",
        "tier": "hostile",
        "transforms": [
          "label_removed",
          "generic_identifier",
          "placeholder_as_label",
          "input_type_degraded"
        ]
      },
      "selector": "form[name=\"f1\"] [name=\"ctl00$txt3\"]"
    },
    {
      "expected_modifiers": [],
      "label": "address-level1",
      "provenance": {
        "control": "select",
        "declared_autocomplete": null,
        "delivery": "static",
        "element_id": "input4",
        "identifier_style": "numbered",
        "injection_slot": null,
        "input_type": null,
        "label_text": null,
        "name": null,
        "placeholder": null,
        "role": "admin_area",
        "section": "address",
        "selector_strategy": "id",
        "shadow_host": null,
        "slot_key": "address.admin_area.4",
        "tier": "hostile",
        "transforms": [
          "label_removed",
          "generic_identifier",
          "no_text_signal"
        ]
      },
      "selector": "#input4"
    },
    {
      "expected_modifiers": [],
      "label": "postal-code",
      "provenance": {
        "control": "input",
        "declared_autocomplete": null,
        "delivery": "shadow",
        "element_id": null,
        "identifier_style": "underscored",
        "injection_slot": null,
        "input_type": "text",
        "label_text": null,
        "name": "field_5",
        "placeholder": "01234",
        "role": "postal_code",
        "section": "address",
        "selector_strategy": "shadow",
        "shadow_host": "ce-1",
        "slot_key": "address.postal_code.5",
        "tier": "hostile",
        "transforms": [
          "label_removed",
          "generic_identifier",
          "placeholder_as_label",
          "input_type_degraded",
          "shadow_root"
        ]
      },
      "selector": "#ce-1 >>> input:nth-of-type(1)"
    },
    {
      "expected_modifiers": [],
      "label": "country-name",
      "provenance": {
        "control": "input",
        "declared_autocomplete": null,
        "delivery": "static",
        "element_id": "ctl00_txt6_40a01533",
        "identifier_style": "hex_id",
        "injection_slot": null,
        "input_type": "text",
        "label_text": null,
        "name": "ctl00$txt6",
        "placeholder": null,
        "role": "country_text",
        "section": "address",
        "selector_strategy": "form_name",
        "shadow_host": null,
        "slot_key": "address.country_text.6",
        "tier": "hostile",
        "transforms": [
          "label_removed",
          "generic_identifier",
          "no_text_signal",
          "input_type_degraded"
        ]
      },
      "selector": "form[name=\"f1\"] [name=\"ctl00$txt6\"]"
    },
    {
      "expected_modifiers": [],
      "label": "UNKNOWN",
      "provenance": {
        "control": "input",
        "declared_autocomplete": null,
        "delivery": "static",
        "element_id": "input7",
        "identifier_style": "numbered",
        "injection_slot": null,
        "input_type": "text",
        "label_text": null,
        "name": null,
        "placeholder": null,
        "role": "undeterminable",
        "section": "address",
        "selector_strategy": "id",
        "shadow_host": null,
        "slot_key": "address.undeterminable.7",
        "tier": "hostile",
        "transforms": [
          "label_removed",
          "generic_identifier",
          "no_text_signal",
          "undeterminable"
        ]
      },
      "selector": "#input7"
    },
    {
      "expected_modifiers": [],
      "label": "NOT_AUTOFILLABLE",
      "provenance": {
        "control": "input",
        "declared_autocomplete": null,
        "delivery": "injected",
        "element_id": "input8",
        "identifier_style": "numbered",
        "injection_slot": "inj-slot-8",
        "input_type": "text",
        "label_text": null,
        "name": "field_8",
        "placeholder": "Search the store",
        "role": "search",
        "section": "address",
        "selector_strategy": "id",
        "shadow_host": null,
        "slot_key": "address.search.8",
        "tier": "hostile",
        "transforms": [
          "label_removed",
          "generic_identifier",
          "injected_after_load"
        ]
      },
      "selector": "#input8"
    }
  ],
  "form_id": "address-03-en-US-hostile-v0",
  "generator_version": "1.0.0",
  "locale": "en-US",
  "page_notes": {
    "canvas_pseudo_fields": [],
    "injected_selectors": [
      "#input8"
    ],
    "shadow_hosts": [
      "#ce-1"
    ]
  },
  "schema_version": 1,
  "template_id": "address-03",
  "tier": "hostile",
  "variant": 0
}
