{
  "family": "address",
  "fields": [
    {
      "expected_modifiers": [],
      "label": "organization",
      "provenance": {
        "control": "input",
        "declared_autocomplete": null,
        "delivery": "static",
        "element_id": null,
        "identifier_style": "bare",
        "injection_slot": null,
        "input_type": "text",
        "label_text": null,
        "name": null,
        "placeholder": "Firma",
        "role": "organization",
        "section": "identity",
        "selector_strategy": "nth_of_type",
        "shadow_host": null,
        "slot_key": "identity.organization.1",
        "tier": "hostile",
        "transforms": [
          "label_removed",
          "generic_identifier",
          "placeholder_as_label",
          "input_type_degraded"
        ]
      },
      "selector": "form[name=\"f1\"] > div:nth-of-type(1) > div:nth-of-type(1) > div:nth-of-type(1) > input:nth-of-type(1)"
    },
    {
      "expected_modifiers": [],
      "label": "address-line1",
      "provenance": {
        "control": "input",
        "declared_autocomplete": null,
        "delivery": "static",
        "element_id": null,
        "identifier_style": "legacy_name",
        "injection_slot": null,
        "input_type": "text",
        "label_text": null,
        "name": "ctl00$txt2",
        "placeholder": null,
        "role": "address_line_1",
        "section": "address",
        "selector_strategy": "form_name",
        "shadow_host": null,
        "slot_key": "address.address_line_1.2",
        "tier": "hostile",
        "transforms": [
          "label_removed",
          "generic_identifier",
          "no_text_signal",
          "input_type_degraded"
        ]
      },
      "selector": "form[name=\"f1\"] [name=\"ctl00$txt2\"]"
    },
    {
      "expected_modifiers": [],
      "label": "address-line2",
      "provenance": {
        "control": "input",
        "declared_autocomplete": null,
        "delivery": "static",
        "element_id": "ctl00_txt3_79ae77c6",
        "identifier_style": "hex_id",
        "injection_slot": null,
        "input_type": "text",
        "label_text": null,
        "name": "ctl00$txt3",
        "placeholder": "Hinterhaus",
        "role": "address_line_2",
        "section": "address",
        "selector_strategy": "form_name",
        "shadow_host": null,
        "slot_key": "address.address_line_2.3",
        "tier": "hostile",
        "transforms": [
          "label_removed",
          "generic_identifier",
          "placeholder_as_label",
          "input_type_degraded"
        ]
      },
      "selector": "form[name=\"f1\"] [name=\"ctl00$txt3\"]"
    },
    {
      "expected_modifiers": [],
      "label": "address-line3",
      "provenance": {
        "control": "input",
        "declared_autocomplete": null,
        "delivery": "shadow",
        "element_id": null,
        "identifier_style": "numbered",
        "injection_slot": null,
        "input_type": "text",
        "label_text": null,
        "name": "field_7",
        "placeholder": null,
        "role": "address_line_3",
        "section": "address",
        "selector_strategy": "shadow",
        "shadow_host": "ce-1",
        "slot_key": "address.address_line_3.4",
        "tier": "hostile",
        "transforms": [
          "label_removed",
          "generic_identifier",
          "no_text_signal",
          "input_type_degraded",
          "shadow_root"
        ]
      },
      "selector": "#ce-1 >>> input:nth-of-type(1)"
    },
    {
      "expected_modifiers": [],
      "label": "postal-code",
      "provenance": {
        "control": "input",
        "declared_autocomplete": null,
        "delivery": "static",
        "element_id": "field_5",
        "identifier_style": "underscored",
        "injection_slot": null,
        "input_type": "text",
        "label_text": null,
        "name": "field_5",
        "placeholder": "12345",
        "role": "postal_code",
        "section": "address",
        "selector_strategy": "id",
        "shadow_host": null,
        "slot_key": "address.postal_code.5",
        "tier": "hostile",
        "transforms": [
          "label_removed",
          "generic_identifier",
          "placeholder_as_label",
          "input_type_degraded"
        ]
      },
      "selector": "#field_5"
    },
    {
      "expected_modifiers": [],
      "label": "address-level2",
      "provenance": {
        "control": "input",
        "declared_autocomplete": null,
        "delivery": "static",
        "element_id": null,
        "identifier_style": "bare",
        "injection_slot": null,
        "input_type": "text",
        "label_text": null,
        "name": null,
        "placeholder": null,
        "role": "city",
        "section": "address",
        "selector_strategy": "nth_of_type",
        "shadow_host": null,
        "slot_key": "address.city.6",
        "tier": "hostile",
        "transforms": [
          "label_removed",
          "generic_identifier",
          "no_text_signal",
          "input_type_degraded"
        ]
      },
      "selector": "form[name=\"f1\"] > div:nth-of-type(2) > div:nth-of-type(5) > div:nth-of-type(1) > input:nth-of-type(1)"
    },
    {
      "expected_modifiers": [],
      "label": "country",
      "provenance": {
        "control": "select",
        "declared_autocomplete": null,
        "delivery": "static",
        "element_id": "ctl00_txt7_8118e183",
        "identifier_style": "hex_id",
        "injection_slot": null,
        "input_type": null,
        "label_text": null,
        "name": "ctl00$txt7",
        "placeholder": "Land",
        "role": "country_select",
        "section": "address",
        "selector_strategy": "form_name",
        "shadow_host": null,
        "slot_key": "address.country_select.7",
        "tier": "hostile",
        "transforms": [
          "label_removed",
          "generic_identifier",
          "placeholder_as_label"
        ]
      },
      "selector": "form[name=\"f1\"] [name=\"ctl00$txt7\"]"
    },
    {
      "expected_modifiers": [],
      "label": "UNKNOWN",
      "provenance": {
        "control": "input",
        "declared_autocomplete": null,
        "delivery": "static",
        "element_id": "input8",
        "identifier_style": "numbered",
        "injection_slot": null,
        "input_type": "text",
        "label_text": null,
        "name": null,
        "placeholder": null,
        "role": "undeterminable",
        "section": "address",
        "selector_strategy": "id",
        "shadow_host": null,
        "slot_key": "address.undeterminable.8",
        "tier": "hostile",
        "transforms": [
          "label_removed",
          "generic_identifier",
          "no_text_signal",
          "undeterminable"
        ]
      },
      "selector": "#input8"
    },
    {
      "expected_modifiers": [],
      "label": "NOT_AUTOFILLABLE",
      "provenance": {
        "control": "input",
        "declared_autocomplete": null,
        "delivery": "injected",
        "element_id": "input9",
        "identifier_style": "numbered",
        "injection_slot": "inj-slot-9",
        "input_type": "text",
        "label_text": null,
        "name": "field_9",
        "placeholder": "Shop durchsuchen",
        "role": "search",
        "section": "address",
        "selector_strategy": "id",
        "shadow_host": null,
        "slot_key": "address.search.9",
        "tier": "hostile",
        "transforms": [
          "label_removed",
          "generic_identifier",
          "injected_after_load"
        ]
      },
      "selector": "#input9"
    }
  ],
  "form_id": "address-02-de-DE-hostile-v0",
  "generator_version": "1.1.0",
  "locale": "de-DE",
  "page_notes": {
    "canvas_pseudo_fields": [],
    "injected_selectors": [
      "#input9"
    ],
    "shadow_hosts": [
      "#ce-1"
    ]
  },
  "schema_version": 1,
  "template_id": "address-02",
  "tier": "hostile",
  "variant": 0
}
