{
  "family": "payment",
  "fields": [
    {
      "expected_modifiers": [],
      "label": "cc-name",
      "provenance": {
        "control": "input",
        "declared_autocomplete": "cc-name",
        "delivery": "static",
        "element_id": "payment-cardholder",
        "identifier_style": "semantic",
        "injection_slot": null,
        "input_type": "text",
        "label_text": "Name on card",
        "name": "payment_cardholder",
        "placeholder": null,
        "role": "card_holder",
        "section": "payment",
        "selector_strategy": "id",
        "shadow_host": null,
        "slot_key": "payment.card_holder.1",
        "tier": "clean",
        "transforms": []
      },
      "selector": "#payment-cardholder"
    },
    {
      "expected_modifiers": [],
      "label": "cc-number",
      "provenance": {
        "control": "input",
        "declared_autocomplete": "cc-number",
        "delivery": "static",
        "element_id": "payment-cardnumber",
        "identifier_style": "semantic",
        "injection_slot": null,
        "input_type": "text",
        "label_text": "Card number",
        "name": "payment_cardnumber",
        "placeholder": "4242 4242 4242 4242",
        "role": "card_number",
        "section": "payment",
        "selector_strategy": "id",
        "shadow_host": null,
        "slot_key": "payment.card_number.2",
        "tier": "clean",
        "transforms": []
      },
      "selector": "#payment-cardnumber"
    },
    {
      "expected_modifiers": [],
      "label": "CC_EXP_SPLIT_MONTH",
      "provenance": {
        "control": "select",
        "declared_autocomplete": "cc-exp-month",
        "delivery": "static",
        "element_id": "security-expmonth",
        "identifier_style": "semantic",
        "injection_slot": null,
        "input_type": null,
        "label_text": "Month",
        "name": "security_expmonth",
        "placeholder": null,
        "role": "card_expiry_split_month",
        "section": "security",
        "selector_strategy": "id",
        "shadow_host": null,
        "slot_key": "security.card_expiry_split_month.3",
        "tier": "clean",
        "transforms": []
      },
      "selector": "#security-expmonth"
    },
    {
      "expected_modifiers": [],
      "label": "CC_EXP_SPLIT_YEAR",
      "provenance": {
        "control": "select",
        "declared_autocomplete": "cc-exp-year",
        "delivery": "static",
        "element_id": "security-expyear",
        "identifier_style": "semantic",
        "injection_slot": null,
        "input_type": null,
        "label_text": "Year",
        "name": "security_expyear",
        "placeholder": null,
        "role": "card_expiry_split_year",
        "section": "security",
        "selector_strategy": "id",
        "shadow_host": null,
        "slot_key": "security.card_expiry_split_year.4",
        "tier": "clean",
        "transforms": []
      },
      "selector": "#security-expyear"
    },
    {
      "expected_modifiers": [],
      "label": "cc-csc",
      "provenance": {
        "control": "input",
        "declared_autocomplete": "cc-csc",
        "delivery": "static",
        "element_id": "security-securitycode",
        "identifier_style": "semantic",
        "injection_slot": null,
        "input_type": "text",
        "label_text": "Security code",
        "name": "security_securitycode",
        "placeholder": "123",
        "role": "card_security_code",
        "section": "security",
        "selector_strategy": "id",
        "shadow_host": null,
        "slot_key": "security.card_security_code.5",
        "tier": "clean",
        "transforms": []
      },
      "selector": "#security-securitycode"
    }
  ],
  "form_id": "payment-01-en-US-clean-v0",
  "generator_version": "1.0.0",
  "locale": "en-US",
  "page_notes": {
    "canvas_pseudo_fields": [],
    "injected_selectors": [],
    "shadow_hosts": []
  },
  "schema_version": 1,
  "template_id": "payment-01",
  "tier": "clean",
  "variant": 0
}
